{
  "schema_version": "kolosseum.registry_seal_snapshot.v1",
  "snapshot_id": "launch_registry_seal_snapshot",
  "snapshot_version": "1.0.0",
  "seal_scope": "registry_bundle",
  "entries": [
    {
      "path": "registries/activity/activity.registry.json",
      "sha256": "f712125ea381f2197dd2683a8c357a7dcbe7c32f79f5e60cdad669c0bcc4dcac"
    },
    {
      "path": "registries/exercise/exercise.registry.json",
      "sha256": "1457f50676163f5ba042d26d7d8b18f13343a5a24707dacb50425356623296cf"
    },
    {
      "path": "registries/exercise/exercise_substitution_graph.json",
      "sha256": "8d97eab5a2149e6e8634f7bf82f3179ae78c2906825bc46fe6588c1d984852c9"
    },
    {
      "path": "registries/exercise/exercise_warmup_mapping.registry.json",
      "sha256": "11f7c41e7b87f8bf0fc9a7470c777497dd5081b5aa6a7d59c6ac5e044ef16829"
    },
    {
      "path": "registries/movement/movement.registry.json",
      "sha256": "4f588172df58d40f2ee79008623a322143eac0261e4268038281faf87c2191cd"
    },
    {
      "path": "registries/program/program.registry.json",
      "sha256": "17808476e0d303ba9e2f8e0f1b74c3a357b4d89c75f7e36902a8f8c88686470e"
    },
    {
      "path": "registries/equipment/equipment.registry.json",
      "sha256": "255907f6864d822ec294eb1d179d1ade367734b85a0f54dc932c3c8e88151a64"
    },
    {
      "path": "registries/sport_subdivision/sport_subdivision.registry.json",
      "sha256": "89d1f415e102e8075c62a7e7cdfd254e84e58ec00a708bb503fac8340d543417"
    },
    {
      "path": "registries/sport_metric/sport_metric.registry.json",
      "sha256": "9c4d3bc7281929d34a8d7662f3f4a887b13b1de4045b0ef7749d8cdba1f5e965"
    },
    {
      "path": "registries/sport_role/sport_role.registry.json",
      "sha256": "d346ffe626aae63d1b11321e188675e0a0d67a6b53073de8ee9777c2d124a931"
    },
    {
      "path": "registries/metric_exercise_link/metric_exercise_link.registry.json",
      "sha256": "b5ca35511d69e449c89a8fd5e3b3758024ca9d056d329dcf29b89086def2c31f"
    },
    {
      "path": "registries/threshold_marker/threshold_marker.registry.json",
      "sha256": "093df088efc63b9210da6e5af792460a2e5a2ac36a01e0933baad3dd89862f66"
    },
    {
      "path": "registries/exercise_token/exercise_token.registry.json",
      "sha256": "be83e6847f1e013b4e2a5441f37795b6f9650d3a27b05159122e382e10a7748f"
    },
    {
      "path": "registries/exercise_activity_applicability/exercise_activity_applicability.registry.json",
      "sha256": "9ee17b4c061eefab2fcf83ebe6b1a245e142dd0baad56cc4ede9a4080add41f2"
    }
  ]
}
